Diagnostico_Codigo;Diagnostico_Desc
M500;TRASTORNO DE DISCO CERVICAL CON MIELOPATÍA (G99.2*)
F059;DELIRIO, NO ESPECIFICADO
K766;HIPERTENSIÓN PORTAL
E848;FIBROSIS QUÍSTICA CON OTRAS MANIFESTACIONES
P008;FETO Y RECIÉN NACIDO AFECTADOS POR OTRAS AFECCIONES MATERNAS
L920;GRANULOMA ANULAR
M204;OTRO(S) DEDO(S) DEL PIE EN MARTILLO (ADQUIRIDOS)
S224;FRACTURAS MÚLTIPLES DE COSTILLAS
K141;LENGUA GEOGRÁFICA
Q699;POLIDACTILIA, NO ESPECIFICADA
R75X;EVIDENCIAS DE LABORATORIO DEL VIRUS DE LA INMUNODEFICIENCIA HUMANA [VIH]
I429;CARDIOMIOPATÍA, NO ESPECIFICADA
S001;CONTUSIÓN DE LOS PÁRPADOS Y DE LA REGIÓN PERIOCULAR
N739;ENFERMEDAD INFLAMATORIA PÉLVICA FEMENINA, NO ESPECIFICADA
T131;HERIDA DE MIEMBRO INFERIOR, NIVEL NO ESPECIFICADO
H698;OTROS TRASTORNOS ESPECIFICADOS DE LA TROMPA DE EUSTAQUIO
R932;HALLAZGOS ANORMALES EN DIAGNÓSTICO POR IMAGEN DEL HÍGADO Y DE LAS VÍAS BILIARES
H360;RETINOPATÍA DIABÉTICA (E10-E14+ CON CUARTO CARÁCTER COMÚN .3)
B203;ENFERMEDAD POR VIH, RESULTANTE EN OTRAS INFECCIONES VIRALES
T235;CORROSIÓN DE LA MUÑECA Y DE LA MANO, DE PRIMER GRADO
I018;OTRAS ENFERMEDADES REUMÁTICAS AGUDAS DEL CORAZÓN
H670;OTITIS MEDIA EN ENFERMEDADES BACTERIANAS CLASIFICADAS EN OTRA PARTE
Q303;PERFORACIÓN CONGÉNITA DEL TABIQUE NASAL
N920;MENSTRUACIÓN EXCESIVA Y FRECUENTE CON CICLO REGULAR
S681;AMPUTACIÓN TRAUMÁTICA DE OTRO DEDO ÚNICO (COMPLETA) (PARCIAL)
N762;VULVITIS AGUDA
N501;TRASTORNOS VASCULARES DE LOS ÓRGANOS GENITALES MASCULINOS
M235;INESTABILIDAD CRÓNICA DE LA RODILLA
N210;CÁLCULO EN LA VEJIGA
A527;OTRAS SÍFILIS TARDÍAS SINTOMÁTICAS
D449;TUMOR DE COMPORTAMIENTO INCIERTO O DESCONOCIDO DE GLÁNDULA ENDOCRINA NO ESPECIFICADA
W228;GOLPE CONTRA O GOLPEADO POR OTROS OBJETOS, EN OTRO LUGAR ESPECIFICADO
G405;SÍNDROMES EPILÉPTICOS ESPECIALES
F315;TRASTORNO AFECTIVO BIPOLAR, EPISODIO DEPRESIVO GRAVE PRESENTE CON SÍNTOMAS PSICÓTICOS
F508;OTROS TRASTORNOS DE LA INGESTIÓN DE ALIMENTOS
I676;TROMBOSIS APIÓGENA DEL SISTEMA VENOSO INTRACRANEAL
J311;RINOFARINGITIS CRÓNICA
O828;OTROS PARTOS ÚNICOS POR CESÁREA
K729;INSUFICIENCIA HEPÁTICA, NO ESPECIFICADA
K121;OTRAS FORMAS DE ESTOMATITIS
M701;BURSITIS DE LA MANO
X640;ENVENENAMIENTO AUTOINFLIGIDO INTENCIONALMENTE POR, Y EXPOSICIÓN A OTRAS DROGAS, MEDICAMENTOS Y SUSTANCIAS BIOLÓGICAS, Y LOS NO ESPECIFICADOS, EN VIVIENDA
C837;TUMOR DE BURKITT
H020;ENTROPIÓN Y TRIQUIASIS PALPEBRAL
A638;OTRAS ENFERMEDADES DE TRANSMISIÓN PREDOMINANTEMENTE SEXUAL, ESPECIFICADAS
M626;DISTENSIÓN MUSCULAR
D376;TUMOR DE COMPORTAMIENTO INCIERTO O DESCONOCIDO DEL HÍGADO, DE LA VESÍCULA BILIAR Y DEL CONDUCTO BILIAR
S311;HERIDA DE LA PARED ABDOMINAL
O680;TRABAJO DE PARTO Y PARTO COMPLICADOS POR ANOMALÍA DE LA FRECUENCIA CARDÍACA FETAL
J448;OTRAS ENFERMEDADES PULMONARES OBSTRUCTIVAS CRÓNICAS ESPECIFICADAS
J181;NEUMONÍA LOBAR, NO ESPECIFICADA
O624;CONTRACCIONES UTERINAS HIPERTÓNICAS, INCOORDINADAS Y PROLONGADAS
H541;CEGUERA DE UN OJO, VISIÓN SUBNORMAL DEL OTRO
O990;ANEMIA QUE COMPLICA EL EMBARAZO, EL PARTO Y EL PUERPERIO
B208;ENFERMEDAD POR VIH, RESULTANTE EN OTRAS ENFERMEDADES INFECCIOSAS O PARASITARIAS
N839;ENFERMEDAD NO INFLAMATORIA DEL OVARIO, DE LA TROMPA DE FALOPIO Y DEL LIGAMENTO ANCHO, NO ESPECIFICADA
F03;DEMENCIA, NO ESPECIFICADA
R268;OTRAS ANORMALIDADES DE LA MARCHA Y DE LA MOVILIDAD Y LAS NO ESPECIFICADAS
N848;PÓLIPOS DE OTRAS PARTES DEL TRACTO GENITAL FEMENINO
Q666;OTRAS DEFORMIDADES VALGUS CONGÉNITAS DE LOS PIES
Q079;MALFORMACIÓN CONGÉNITA DEL SISTEMA NERVIOSO, NO ESPECIFICADA
S411;HERIDA DEL BRAZO
F952;TRASTORNO POR TICS MOTORES Y VOCALES MÚLTIPLES COMBINADOS [DE LA TOURETTE]
D072;CARCINOMA IN SITU DE LA VAGINA
Z933;COLOSTOMÍA
R258;OTROS MOVIMIENTOS ANORMALES INVOLUNTARIOS Y LOS NO ESPECIFICADOS
F165;TRASTORNOS MENTALES Y DEL COMPORTAMIENTO DEBIDOS AL USO DE ALUCINÓGENOS, TRASTORNO PSICÓTICO
S868;TRAUMATISMO DE OTROS TENDONES Y MÚSCULOS A NIVEL DE LA PIERNA
G562;LESIÓN DEL NERVIO CUBITAL
C609;TUMOR MALIGNO DEL PENE, PARTE NO ESPECIFICADA
C50X;TUMOR MALIGNO DE LA MAMA
L810;HIPERPIGMENTACIÓN POSTINFLAMATORIA
B206;ENFERMEDAD POR VIH, RESULTANTE EN NEUMONÍA POR PNEUMOCYSTIS CARINII
A059;INTOXICACIÓN ALIMENTARIA BACTERIANA, NO ESPECIFICADA
C251;TUMOR MALIGNO DEL CUERPO DEL PÁNCREAS
I738;OTRAS ENFERMEDADES VASCULARES PERIFÉRICAS ESPECIFICADAS
G578;OTRAS MONONEUROPATÍAS DEL MIEMBRO INFERIOR
K750;ABSCESO DEL HÍGADO
Q311;ESTENOSIS SUBGLÓTICA CONGÉNITA
O020;DETENCIÓN DEL DESARROLLO DEL HUEVO Y MOLA NO HIDATIFORME
T114;TRAUMATISMO DE VASOS SANGUÍNEOS NO ESPECIFICADOS DE MIEMBRO SUPERIOR, NIVEL NO ESPECIFICADO
J321;SINUSITIS FRONTAL CRÓNICA
B211;ENFERMEDAD POR VIH, RESULTANTE EN LINFOMA DE BURKITT
H531;ALTERACIONES VISUALES SUBJETIVAS
I800;FLEBITIS Y TROMBOFLEBITIS DE VASOS SUPERFICIALES DE LOS MIEMBROS INFERIORES
S142;TRAUMATISMO DE RAÍZ NERVIOSA DE COLUMNA CERVICAL
R190;TUMEFACCIÓN, MASA O PROMINENCIA INTRAABDOMINAL Y PÉLVICA
G552;COMPRESIONES DE LAS RAÍCES Y PLEXOS NERVIOSOS EN LA ESPONDILOSIS (M47.-+)
P38X;ONFALITIS DEL RECIÉN NACIDO CON O SIN HEMORRAGIA LEVE
I256;ISQUEMIA SILENTE DEL MIOCARDIO
E725;TRASTORNOS DEL METABOLISMO DE LA GLICINA
C049;TUMOR MALIGNO DEL PISO DE LA BOCA, PARTE NO ESPECIFICADA
X206;CONTACTO TRAUMÁTICO CON SERPIENTES Y LAGARTOS VENENOSOS, EN ÁREA INDUSTRIAL Y DE LA CONSTRUCCIÓN
S337;ESGUINCES Y TORCEDURAS DE OTRAS PARTES Y DE LAS NO ESPECIFICADAS DE LA COLUMNA LUMBAR Y DE LA PELVIS
H439;TRASTORNO DEL CUERPO VÍTREO, NO ESPECIFICADO
Z641;PROBLEMAS RELACIONADOS CON LA MULTIPARIDAD
K118;OTRAS ENFERMEDADES DE LAS GLÁNDULAS SALIVALES
L258;DERMATITIS DE CONTACTO, FORMA NO ESPECIFICADA, DEBIDA A OTROS AGENTES
S708;OTROS TRAUMATISMOS SUPERFICIALES DE LA CADERA Y DEL MUSLO
E301;PUBERTAD PRECOZ
P720;BOCIO NEONATAL, NO CLASIFICADO EN OTRA PARTE
M206;DEFORMIDADES ADQUIRIDAS DE LOS DEDOS DEL PIE, NO ESPECIFICADAS
P761;ILEO TRANSITORIO DEL RECIÉN NACIDO
N281;QUISTE DE RIÑÓN, ADQUIRIDO
S436;ESGUINCES Y TORCEDURAS DE LA ARTICULACIÓN ESTERNOCLAVICULAR
H201;IRIDOCICLITIS CRÓNICA
M688;OTROS TRASTORNOS SINOVIALES Y TENDINOSOS EN ENFERMEDADES CLASIFICADAS EN OTRA PARTE
F519;TRASTORNO NO ORGÁNICO DEL SUEÑO, NO ESPECIFICADO
C794;TUMOR MALIGNO SECUNDARIO DE OTRAS PARTES DEL SISTEMA NERVIOSO Y DE LAS NO ESPECIFICADAS
K263;ULCERA DUODENAL, AGUDA SIN HEMORRAGIA NI PERFORACIÓN
C73;TUMOR MALIGNO DE LA GLÁNDULA TIROIDES
K621;PÓLIPO RECTAL
D101;TUMOR BENIGNO DE LA LENGUA
L233;DERMATITIS ALÉRGICA DE CONTACTO DEBIDA A DROGAS EN CONTACTO CON LA PIEL
N766;ULCERACIÓN DE LA VULVA
W450;CUERPO EXTRAÑO QUE PENETRA A TRAVÉS DE LA PIEL, EN VIVIENDA
E872;ACIDOSIS
Z834;HISTORIA FAMILIAR DE OTRAS ENFERMEDADES ENDOCRINAS, NUTRICIONALES Y METABÓLICAS
F900;PERTURBACIÓN DE LA ACTIVIDAD Y DE LA ATENCIÓN
Q670;ASIMETRÍA FACIAL
H111;DEGENERACIONES Y DEPÓSITOS CONJUNTIVALES
N981;HIPERESTIMULACIÓN DE OVARIOS
C411;TUMOR MALIGNO DEL HUESO DEL MAXILAR INFERIOR
N959;TRASTORNO MENOPÁUSICO Y PERIMENOPÁUSICO, NO ESPECIFICADO
J300;RINITIS VASOMOTORA
C328;LESIÓN DE SITIOS CONTIGUOS DE LA LARINGE
J151;NEUMONÍA DEBIDA A PSEUDOMONAS
Z762;CONSULTA PARA ATENCIÓN Y SUPERVISIÓN DE LA SALUD DE OTROS NIÑOS O LACTANTES SANOS
G809;PARÁLISIS CEREBRAL INFANTIL, SIN OTRA ESPECIFICACIÓN
C300;TUMOR MALIGNO DE LA FOSA NASAL
C902;PLASMOCITOMA, EXTRAMEDULAR
H542;VISIÓN SUBNORMAL DE AMBOS OJOS
G549;TRASTORNO DE LA RAÍZ Y PLEXOS NERVIOSOS, NO ESPECIFICADO
T435;OTROS ANTIPSICÓTICOS Y NEUROLÉPTICOS Y LOS NO ESPECIFICADOS
Q120;CATARATA CONGÉNITA
B24;ENFERMEDAD POR VIRUS DE LA INMUNODEFICIENCIA HUMANA [VIH], SIN OTRA ESPECIFICACIÓN
E031;HIPOTIROIDISMO CONGÉNITO SIN BOCIO
D430;TUMOR DE COMPORTAMIENTO INCIERTO O DESCONOCIDO DEL ENCÉFALO, SUPRATENTORIAL
T111;HERIDA DE MIEMBRO SUPERIOR, NIVEL NO ESPECIFICADO
O121;PROTEINURIA GESTACIONAL
W554;MORDEDURA O ATAQUE DE OTROS MAMÍFEROS, EN CALLES Y CARRETERAS
K404;HERNIA INGUINAL UNILATERAL O NO ESPECIFICADA, CON GANGRENA
N802;ENDOMETRIOSIS DE LA TROMPA DE FALOPIO
E200;HIPOPARATIROIDISMO IDIOPÁTICO
K518;OTRAS COLITIS ULCERATIVAS
N63;MASA NO ESPECIFICADA EN LA MAMA
T833;COMPLICACIÓN MECÁNICA DE DISPOSITIVO ANTICONCEPTIVO INTRAUTERINO
T138;OTROS TRAUMATISMOS ESPECIFICADOS DE MIEMBRO INFERIOR, NIVEL NO ESPECIFICADO
K061;HIPERPLASIA GINGIVAL
R930;HALLAZGOS ANORMALES EN DIAGNÓSTICO POR IMAGEN DEL CRÁNEO Y DE LA CABEZA, NO CLASIFICADOS EN OTRA PARTE
K314;DIVERTÍCULO GÁSTRICO
P704;OTRAS HIPOGLICEMIAS NEONATALES
O064;ABORTO NO ESPECIFICADO, INCOMPLETO, SIN COMPLICACIÓN
Z975;PRESENCIA DE DISPOSITIVO ANTICONCEPTIVO (INTRAUTERINO)
G550;COMPRESIONES DE LAS RAÍCES Y PLEXOS NERVIOSOS EN ENFERMEDADES NEOPLÁSICAS (C00-D48+)
H533;OTROS TRASTORNOS DE LA VISIÓN BINOCULAR
F401;FOBIAS SOCIALES
E040;BOCIO DIFUSO NO TÓXICO
D160;TUMOR BENIGNO DEL OMÓPLATO Y HUESOS LARGOS DEL MIEMBRO SUPERIOR
H170;LEUCOMA ADHERENTE
J158;OTRAS NEUMONÍAS BACTERIANAS
G443;CEFALEA POSTRAUMÁTICA CRÓNICA
P920;VÓMITOS DEL RECIÉN NACIDO
N915;OLIGOMENORREA, NO ESPECIFICADA
F069;TRASTORNO MENTAL NO ESPECIFICADO DEBIDO A LESIÓN Y DISFUNCIÓN CEREBRAL Y A ENFERMEDAD FÍSICA
D733;ABSCESO DEL BAZO
S949;TRAUMATISMO DE NERVIO NO ESPECIFICADO A NIVEL DEL PIE Y DEL TOBILLO
M793;PANICULITIS, NO ESPECIFICADA
K639;ENFERMEDAD DEL INTESTINO, NO ESPECIFICADA
Z048;EXAMEN Y OBSERVACIÓN POR OTRAS RAZONES ESPECIFICADAS
H189;TRASTORNO DE LA CÓRNEA, NO ESPECIFICADO
J010;SINUSITIS MAXILAR AGUDA
M664;RUPTURA ESPONTÁNEA DE OTROS TENDONES
L853;XEROSIS DEL CUTIS
C821;LINFOMA NO HODKIN MIXTO, DE PEQUEÑAS CÉLULAS HENDIDAS Y DE GRANDES CÉLULAS, FOLICULAR
M256;RIGIDEZ ARTICULAR, NO CLASIFICADA EN OTRA PARTE
L512;NECRÓLISIS EPIDÉRMICA TÓXICA [LYELL]
E281;EXCESO DE ANDRÓGENOS
N391;PROTEINURIA PERSISTENTE, NO ESPECIFICADA
M068;OTRAS ARTRITIS REUMATOIDES ESPECIFICADAS
G580;NEUROPATÍA INTERCOSTAL
C712;TUMOR MALIGNO DEL LÓBULO TEMPORAL
G360;NEUROMIELITIS ÓPTICA [DEVIC]
I845;HEMORROIDES EXTERNAS SIN COMPLICACIÓN
M257;OSTEOFITO
J205;BRONQUITIS AGUDA DEBIDA A VIRUS SINCITIAL RESPIRATORIO
R72X;ANORMALIDADES DE LOS LEUCOCITOS, NO CLASIFICADAS EN OTRA PARTE
T888;OTRAS COMPLICACIONES ESPECIFICADAS DE LA ATENCIÓN MÉDICA Y QUIRÚRGICA, NO CLASIFICADAS EN OTRA PARTE
P749;TRASTORNO METABÓLICO TRANSITORIO DEL RECIÉN NACIDO, NO ESPECIFICADO
H168;OTRAS QUERATITIS
K739;HEPATITIS CRÓNICA, NO ESPECIFICADA
S058;OTROS TRAUMATISMOS DEL OJO Y DE LA ÓRBITA
N804;ENDOMETRIOSIS DEL TABIQUE RECTOVAGINAL Y DE LA VAGINA
S321;FRACTURA DEL SACRO
F330;TRASTORNO DEPRESIVO RECURRENTE, EPISODIO LEVE PRESENTE
F913;TRASTORNO OPOSITOR DESAFIANTE
R521;DOLOR CRÓNICO INTRATABLE
Z907;AUSENCIA ADQUIRIDA DE ÓRGANO(S) GENITAL(ES)
D539;ANEMIA NUTRICIONAL, NO ESPECIFICADA
T311;QUEMADURAS QUE AFECTAN DEL 10 AL 19% DE LA SUPERFICIE DEL CUERPO
N751;ABSCESO DE LA GLÁNDULA DE BARTHOLIN
O122;EDEMA GESTACIONAL CON PROTEINURIA
S552;TRAUMATISMO DE VENA A NIVEL DEL ANTEBRAZO
L282;OTROS PRURIGOS
C830;LINFOMA NO HODGKIN DE CÉLULAS PEQUEÑAS (DIFUSO)
H728;OTRAS PERFORACIONES DE LA MEMBRANA TIMPÁNICA
N411;PROSTATITIS CRÓNICA
R041;HEMORRAGIA DE LA GARGANTA
I749;EMBOLIA Y TROMBOSIS DE ARTERIA NO ESPECIFICADA
T751;AHOGAMIENTO Y SUMERSIÓN NO MORTAL
C538;LESIÓN DE SITIOS CONTIGUOS DEL CUELLO DEL ÚTERO
R223;TUMEFACCIÓN, MASA O PROMINENCIA LOCALIZADA EN EL MIEMBRO SUPERIOR
Q446;ENFERMEDAD QUÍSTICA DEL HÍGADO
K572;ENFERMEDAD DIVERTICULAR DEL INTESTINO GRUESO CON PERFORACIÓN Y ABSCESO
I440;BLOQUEO AURICULOVENTRICULAR DE PRIMER GRADO
C181;TUMOR MALIGNO DEL APÉNDICE
D45X;POLICITEMIA VERA
J90;DERRAME PLEURAL NO CLASIFICADO EN OTRA PARTE
C438;MELANOMA MALIGNO DE SITIOS CONTIGUOS DE LA PIEL
M932;OSTEOCONDRITIS DISECANTE
C07X;TUMOR MALIGNO DE LA GLÁNDULA PARÓTIDA
D222;NEVO MELANOCÍTICO DE LA OREJA Y DEL CONDUCTO AUDITIVO EXTERNO
C762;TUMOR MALIGNO DEL ABDOMEN
T202;QUEMADURA DE LA CABEZA Y DEL CUELLO, DE SEGUNDO GRADO
C780;TUMOR MALIGNO SECUNDARIO DEL PULMÓN
S330;RUPTURA TRAUMÁTICA DE DISCO INTERVERTEBRAL LUMBAR
S399;TRAUMATISMO NO ESPECIFICADO DEL ABDOMEN, DE LA REGIÓN LUMBOSACRA Y DE LA PELVIS
G540;TRASTORNOS DEL PLEXO BRAQUIAL
F848;OTROS TRASTORNOS GENERALIZADOS DEL DESARROLLO
M952;OTRAS DEFORMIDADES ADQUIRIDAS DE LA CABEZA
S122;FRACTURA DE OTRAS VÉRTEBRAS CERVICALES ESPECIFICADAS
G049;ENCEFALITIS, MIELITIS Y ENCEFALOMIELITIS, NO ESPECIFICADAS
M928;OTRAS OSTEOCONDROSIS JUVENILES ESPECIFICADAS
I740;EMBOLIA Y TROMBOSIS DE LA AORTA ABDOMINAL
P700;SÍNDROME DEL RECIÉN NACIDO DE MADRE CON DIABETES GESTACIONAL
Z35X;SUPERVISION DE EMBARAZO DE ALTO RIESGO
C577;TUMOR MALIGNO DE OTRAS PARTES ESPECIFICADAS DE LOS ÓRGANOS GENITALES FEMENINOS
K276;ULCERA PÉPTICA, DE SITIO NO ESPECIFICADO, CRÓNICA O NO ESPECIFICADA, CON HEMORRAGIA Y PERFORACIÓN
Z803;HISTORIA FAMILIAR DE TUMOR MALIGNO DE MAMA
M081;ESPONDILITIS ANQUILOSANTE JUVENIL
T263;QUEMADURA DE OTRAS PARTES DEL OJO Y SUS ANEXOS
C822;LINFOMA NO HODGKIN DE CÉLULAS GRANDES, FOLICULAR
Z718;OTRAS CONSULTAS ESPECIFICADAS
W210;GOLPE CONTRA O GOLPEADO POR EQUIPO PARA DEPORTES, EN  VIVIENDA
K413;HERNIA FEMORAL UNILATERAL O NO ESPECIFICADA, CON OBSTRUCCIÓN, SIN GANGRENA
X618;ENVENENAMIENTO AUTOINFLIGIDO INTENCIONALMENTE POR, Y EXPOSICIÓN A DROGAS ANTIEPILÉPTICAS, SEDANTES, HIPNÓTICAS, ANTIPARKINSONIANAS Y PSICOTRÓPICAS, NO CLASIFICADAS EN OTRA PARTE, EN OTRO LUGAR ESPECIFICADO
T170;CUERPO EXTRAÑO EN SENO PARANASAL
N318;OTRAS DISFUNCIONES NEUROMUSCULARES DE LA VEJIGA
T481;RELAJANTES MUSCULOESQUELÉTICOS [AGENTES BLOQUEADORES NEUROMUSCULARES]
K046;ABSCESO PERIAPICAL CON FÍSTULA
Y803;APARATOS DE MEDICINA FÍSICA ASOCIADOS CON INCIDENTES ADVERSOS, INSTRUMENTOS QUIRÚRGICOS, DISPOSITIVOS Y MATERIALES (INCLUSIVE SUTURAS)
H181;QUERATOPATÍA VESICULAR
S336;ESGUINCES Y TORCEDURAS DE LA ARTICULACIÓN SACROILIACA
L551;QUEMADURA SOLAR DE SEGUNDO GRADO
N991;ESTRECHEZ URETRAL CONSECUTIVA A PROCEDIMIENTOS
J390;ABSCESO RETROFARÍNGEO Y PARAFARÍNGEO
R443;ALUCINACIONES, NO ESPECIFICADAS
T905;SECUELAS DE TRAUMATISMO INTRACRANEAL
N994;ADHERENCIAS PERITONEALES PÉLVICAS CONSECUTIVAS A PROCEDIMIENTOS
Z952;PRESENCIA DE VÁLVULA CARDÍACA PROTÉSICA
C040;TUMOR MALIGNO DE LA PARTE ANTERIOR DEL PISO DE LA BOCA
C795;TUMOR MALIGNO SECUNDARIO DE LOS HUESOS Y DE LA MÉDULA ÓSEA
M651;OTRAS (TENO)SINOVITIS INFECCIOSAS
T302;QUEMADURA DE SEGUNDO GRADO, REGIÓN DEL CUERPO NO ESPECIFICADA
N902;DISPLASIA VULVAR SEVERA, NO CLASIFICADA EN OTRA PARTE
G589;MONONEUROPATÍA, NO ESPECIFICADA
X440;ENVENENAMIENTO ACCIDENTAL POR, Y EXPOSICIÓN A OTRAS DROGAS, MEDICAMENTOS Y SUSTANCIAS BIOLÓGICAS, Y LOS NO ESPECIFICADOS, EN VIVIENDA
O030;ABORTO ESPONTÁNEO, INCOMPLETO, COMPLICADO CON INFECCIÓN GENITAL Y PELVIANA
Q396;DIVERTÍCULO DEL ESÓFAGO
D397;TUMOR DE COMPORTAMIENTO INCIERTO O DESCONOCIDO DE OTROS ÓRGANOS GENITALES FEMENINOS
Y525;EFECTOS ADVERSOS DE OTRAS DROGAS ANTIHIPERTENSIVAS, NO CLASIFICADAS EN OTRA PARTE
H368;OTROS TRASTORNOS DE LA RETINA EN ENFERMEDADES CLASIFICADAS EN OTRA PARTE
W500;APORREO, GOLPE, MORDEDURA, PATADA, RASGUÑO O TORCEDURA INFLIGIDOS POR OTRA PERSONA, EN VIVIENDA
N429;TRASTORNO DE LA PRÓSTATA, NO ESPECIFICADO
N320;OBSTRUCCIÓN DE CUELLO DE LA VEJIGA
K519;COLITIS ULCERATIVA, SIN OTRA ESPECIFICACIÓN
K660;ADHERENCIAS PERITONEALES
W448;CUERPO EXTRAÑO QUE PENETRA POR EL OJO U ORIFICIO NATURAL, EN OTRO LUGAR ESPECIFICADO
M249;DESARREGLO ARTICULAR, NO ESPECIFICADO
O008;OTROS EMBARAZOS ECTÓPICOS
M130;POLIARTRITIS, NO ESPECIFICADA
S200;CONTUSIÓN DE LA MAMA
W559;MORDEDURA O ATAQUE DE OTROS MAMÍFEROS, EN LUGAR NO ESPECIFICADO
I639;INFARTO CEREBRAL, NO ESPECIFICADO
G500;NEURALGIA DEL TRIGÉMINO
H651;OTRA OTITIS MEDIA AGUDA, NO SUPURATIVA
H481;NEURITIS RETROBULBAR EN ENFERMEDADES CLASIFICADAS EN OTRA PARTE
Z206;CONTACTO CON Y EXPOSICIÓN AL VIRUS DE LA INMUNODEFICIENCIA HUMANA [VIH]
N923;HEMORRAGIA POR OVULACIÓN
T098;OTROS TRAUMATISMOS ESPECIFICADOS DEL TRONCO, NIVEL NO ESPECIFICADO
E060;TIROIDITIS AGUDA
M503;OTRAS DEGENERACIONES DE DISCO CERVICAL
E46X;DESNUTRICIÓN PROTEICOCALÓRICA, NO ESPECIFICADA
S632;LUXACIONES MÚLTIPLES DE DEDOS DE LA MANO
E835;TRASTORNOS DEL METABOLISMO DEL CALCIO
I42X;CARDIOMIOPATIA
C211;TUMOR MALIGNO DEL CONDUCTO ANAL
M216;OTRAS DEFORMIDADES ADQUIRIDAS DEL TOBILLO Y DEL PIE
C531;TUMOR MALIGNO DEL EXOCÉRVIX
S198;OTROS TRAUMATISMOS DEL CUELLO, ESPECIFICADOS
O82X;PARTO UNICO POR CESAREA
O421;RUPTURA PREMATURA DE LAS MEMBRANAS, E INICIO DEL TRABAJO DE PARTO DESPUÉS DE LAS 24 HORAS
I340;INSUFICIENCIA (DE LA VÁLVULA) MITRAL
B965;PSEUDOMONAS (AERUGINOSA) (MALLEI) (PSEUDOMALLEI) COMO CAUSA DE ENFERMEDADES CLASIFICADAS EN OTROS CAPÍTULOS
I518;OTRAS ENFERMEDADES CARDÍACAS MAL DEFINIDAS
H526;OTROS TRASTORNOS DE LA REFRACCIÓN
M174;OTRAS GONARTROSIS SECUNDARIAS, BILATERALES
S948;TRAUMATISMO DE OTROS NERVIOS A NIVEL DEL PIE Y DEL TOBILLO
M856;OTROS QUISTES ÓSEOS
A58X;GRANULOMA INGUINAL
B49X;MICOSIS, NO ESPECIFICADA
F989;TRASTORNOS NO ESPECIFICADOS, EMOCIONALES Y DEL COMPORTAMIENTO, QUE APARECEN HABITUALMENTE EN LA NIÑEZ Y EN LA ADOLESCENCIA
F418;OTROS TRASTORNOS DE ANSIEDAD ESPECIFICADOS
R198;OTROS SÍNTOMAS Y SIGNOS ESPECIFICADOS QUE INVOLUCRAN EL SISTEMA DIGESTIVO Y EL ABDOMEN
N083;TRASTORNOS GLOMERULARES EN DIABETES MELLITUS (E10-E14+ CON CUARTO CARÁCTER COMÚN .2)
K522;COLITIS Y GASTROENTERITIS ALÉRGICAS Y DIETÉTICAS
K626;ULCERA DEL ANO Y DEL RECTO
C180;TUMOR MALIGNO DEL CIEGO
R21X;SALPULLIDO Y OTRAS ERUPCIONES CUTÁNEAS NO ESPECIFICADAS
B340;INFECCIÓN DEBIDA A ADENOVIRUS, SIN OTRA ESPECIFICACIÓN
F523;DISFUNCIÓN ORGÁSMICA
W459;CUERPO EXTRAÑO QUE PENETRA A TRAVÉS DE LA PIEL, EN LUGAR NO ESPECIFICADO
Z203;CONTACTO CON Y EXPOSICIÓN A RABIA
P914;DEPRESIÓN CEREBRAL NEONATAL
A062;COLITIS AMEBIANA NO DISENTÉRICA
Z21X;ESTADO DE INFECCIÓN ASINTOMÁTICA POR EL VIRUS DE LA INMUNODEFICIENCIA HUMANA [VIH]
R251;TEMBLOR NO ESPECIFICADO
G569;MONONEUROPATÍA DEL MIEMBRO SUPERIOR, SIN OTRA ESPECIFICACIÓN
Z319;ATENCIÓN NO ESPECIFICADA RELACIONADA CON LA PROCREACIÓN
K220;ACALASIA DEL CARDIAS
Z505;TERAPIA DEL LENGUAJE
S829;FRACTURA DE LA PIERNA, PARTE NO ESPECIFICADA
S530;LUXACIÓN DE LA CABEZA DEL RADIO
Q669;DEFORMIDAD CONGÉNITA DE LOS PIES, NO ESPECIFICADA
C845;OTROS LINFOMAS DE CÉLULAS T Y LOS NO ESPECIFICADOS
A009;CÓLERA, NO ESPECIFICADO
W550;MORDEDURA O ATAQUE DE OTROS MAMÍFEROS, EN VIVIENDA
D214;TUMOR BENIGNO DEL TEJIDO CONJUNTIVO Y OTROS TEJIDOS BLANDOS DEL ABDOMEN
R068;OTRAS ANORMALIDADES DE LA RESPIRACIÓN Y LAS NO ESPECIFICADAS
O60;PARTO PREMATURO
M472;OTRAS ESPONDILOSIS CON RADICULOPATÍA
S867;TRAUMATISMO DE MÚLTIPLES TENDONES Y MÚSCULOS A NIVEL DE LA PIERNA
S62;FRACTURA A NIVEL DE LA MUÑECA Y DE LA MANO
H318;OTROS TRASTORNOS ESPECIFICADOS DE LA COROIDES
J118;INFLUENZA CON OTRAS MANIFESTACIONES, VIRUS NO IDENTIFICADO
S002;OTROS TRAUMATISMOS SUPERFICIALES DEL PÁRPADO Y DE LA REGIÓN PERIOCULAR
A491;INFECCIÓN ESTREPTOCÓCICA, SIN OTRA ESPECIFICACIÓN
K921;MELENA
D061;CARCINOMA IN SITU DEL EXOCÉRVIX
N499;TRASTORNO INFLAMATORIO DE ÓRGANO GENITAL MASCULINO, NO ESPECIFICADO
Z101;CONTROL GENERAL DE SALUD DE RUTINA DE RESIDENTES DE INSTITUCIONES
J020;FARINGITIS ESTREPTOCÓCICA
H182;OTROS EDEMAS DE LA CÓRNEA
J206;BRONQUITIS AGUDA DEBIDA A RINOVIRUS
Z031;OBSERVACIÓN POR SOSPECHA DE TUMOR MALIGNO
D067;CARCINOMA IN SITU DE OTRAS PARTES ESPECIFICADAS DEL CUELLO DEL ÚTERO
A509;SÍFILIS CONGÉNITA, SIN OTRA ESPECIFICACIÓN
J11X;INFLUENZA DEBIDA A VIRUS NO IDENTIFICADO
S642;TRAUMATISMO DEL NERVIO RADIAL A NIVEL DE LA MUÑECA Y DE LA MANO
K450;OTRAS HERNIAS DE LA CAVIDAD ABDOMINAL ESPECIFICADAS, CON OBSTRUCCIÓN, SIN GANGRENA
Q179;MALFORMACIÓN CONGÉNITA DEL OÍDO, NO ESPECIFICADA
W458;CUERPO EXTRAÑO QUE PENETRA A TRAVÉS DE LA PIEL, EN OTRO LUGAR ESPECIFICADO
P031;FETO Y RECIÉN NACIDO AFECTADOS POR OTRA PRESENTACIÓN ANÓMALA, POSICIÓN ANÓMALA Y DESPROPORCIÓN DURANTE EL TRABAJO DE PARTO Y EL PARTO
L648;OTRAS ALOPECIAS ANDRÓGENAS
I428;OTRAS CARDIOMIOPATÍAS
H349;OCLUSIÓN VASCULAR RETINIANA, SIN OTRA ESPECIFICACIÓN
N137;UROPATÍA ASOCIADA CON REFLUJO VESICOURETERAL
Q250;CONDUCTO ARTERIOSO PERMEABLE
D689;DEFECTO DE LA COAGULACIÓN, NO ESPECIFICADO
F102;TRASTORNOS MENTALES Y DEL COMPORTAMIENTO DEBIDOS AL USO DE ALCOHOL, SÍNDROME DE DEPENDENCIA
K632;FÍSTULA DEL INTESTINO
J849;ENFERMEDAD PULMONAR INTERSTICIAL, NO ESPECIFICADA
Z350;SUPERVISIÓN DE EMBARAZO CON HISTORIA DE ESTERILIDAD
E103;DIABETES MELLITUS INSULINODEPENDIENTE, CON COMPLICACIONES OFTÁLMICAS
G120;ATROFIA MUSCULAR ESPINAL INFANTIL, TIPO I [WERDNIG-HOFFMAN]
D358;TUMOR BENIGNO PLURIGLANDULAR
F510;INSOMNIO NO ORGÁNICO
P95X;MUERTE FETAL DE CAUSA NO ESPECIFICADA
T251;QUEMADURA DEL TOBILLO Y DEL PIE, DE PRIMER GRADO
G245;BLEFAROSPASMO
N816;RECTOCELE
T141;HERIDA DE REGIÓN NO ESPECIFICADA DEL CUERPO
J949;AFECCIÓN PLEURAL, NO ESPECIFICADA
C812;ENFERMEDAD DE HODGKIN CON CELULARIDAD MIXTA
C343;TUMOR MALIGNO DEL LÓBULO INFERIOR, BRONQUIO O PULMÓN
I479;TAQUICARDIA PAROXÍSTICA, NO ESPECIFICADA
S817;HERIDAS MÚLTIPLES DE LA PIERNA
M861;OTRAS OSTEOMIELITIS AGUDAS
J028;FARINGITIS AGUDA DEBIDA A OTROS MICROORGANISMOS ESPECIFICADOS
G600;NEUROPATÍA HEREDITARIA MOTORA Y SENSORIAL
S313;HERIDA DEL ESCROTO Y DE LOS TESTÍCULOS
K57X;ENFERMEDAD DIVERTICULAR DEL INTESTINO
K112;SIALADENITIS
P360;SEPSIS DEL RECIÉN NACIDO DEBIDA A ESTREPTOCOCO DEL GRUPO B
M778;OTRAS ENTESOPATÍAS, NO CLASIFICADAS EN OTRA PARTE
Z025;EXAMEN PARA PARTICIPACIÓN EN COMPETENCIAS DEPORTIVAS
F312;TRASTORNO AFECTIVO BIPOLAR, EPISODIO MANÍACO PRESENTE CON SÍNTOMAS PSICÓTICOS
R611;HIPERHIDROSIS GENERALIZADA
P080;RECIÉN NACIDO EXCEPCIONALMENTE GRANDE
N857;HEMATÓMETRA
Q253;ESTENOSIS DE LA AORTA
M036;ARTROPATÍA REACTIVA EN OTRAS ENFERMEDADES CLASIFICADAS EN OTRA PARTE
I253;ANEURISMA CARDÍACO
X894;AGRESIÓN CON OTROS PRODUCTOS QUÍMICOS Y SUSTANCIAS NOCIVAS ESPECIFICADAS, EN CALLES Y CARRETERAS
D481;TUMOR DE COMPORTAMIENTO INCIERTO O DESCONOCIDO DEL TEJIDO CONJUNTIVO Y OTRO TEJIDO BLANDO
Q728;OTROS DEFECTOS POR REDUCCIÓN DEL (DE LOS) MIEMBRO(S) INFERIOR(ES)
S268;OTROS TRAUMATISMOS DEL CORAZÓN
P611;POLICITEMIA NEONATAL
I694;SECUELAS DE ENFERMEDAD CEREBROVASCULAR, NO ESPECIFICADA COMO HEMORRÁGICA U OCLUSIVA
L981;DERMATITIS FACTICIA
Q825;NEVO NO NEOPLÁSICO, CONGÉNITO
D429;TUMOR DE COMPORTAMIENTO INCIERTO O DESCONOCIDO DE LAS MENINGES, PARTE NO ESPECIFICADA
L292;PRURITO VULVAR
S218;HERIDA DE OTRAS PARTES DEL TÓRAX
L42X;PITIRIASIS ROSADA
Z128;EXAMEN DE PESQUISA ESPECIAL PARA TUMORES DE OTROS SITIOS
M665;RUPTURA ESPONTÁNEA DE TENDÓN NO ESPECIFICADO
D002;CARCINOMA IN SITU DEL ESTÓMAGO
P588;ICTERICIA NEONATAL DEBIDA A OTRAS HEMÓLISIS EXCESIVAS ESPECIFICADAS
O419;TRASTORNO DEL LÍQUIDO AMNIÓTICO Y DE LAS MEMBRANAS, NO ESPECIFICADO
B582;MENINGOENCEFALITIS DEBIDA A TOXOPLASMA (G05.2*)
N20X;CALCULO DEL RINON Y DEL URETER
D309;TUMOR BENIGNO DE ÓRGANO URINARIO NO ESPECIFICADO
Q351;FISURA DEL PALADAR DURO, UNILATERAL
H920;OTALGIA
K928;OTRAS ENFERMEDADES ESPECIFICADAS DEL SISTEMA DIGESTIVO
S252;TRAUMATISMO DE VENA CAVA SUPERIOR
C089;TUMOR MALIGNO DE GLÁNDULA SALIVAL MAYOR, NO ESPECIFICADA
F251;TRASTORNO ESQUIZOAFECTIVO DE TIPO DEPRESIVO
J380;PARÁLISIS DE LAS CUERDAS VOCALES Y DE LA LARINGE
B021;MENINGITIS DEBIDA A HERPES ZOSTER (G02.0*)
N710;ENFERMEDAD INFLAMATORIA AGUDA DEL ÚTERO
M159;POLIARTROSIS, NO ESPECIFICADA
N178;OTRAS INSUFICIENCIAS RENALES AGUDAS
L130;DERMATITIS HERPETIFORME
E831;TRASTORNOS DEL METABOLISMO DEL HIERRO
L628;TRASTORNOS DE LAS UÑAS EN OTRAS ENFERMEDADES CLASIFICADAS EN OTRA PARTE
K500;ENFERMEDAD DE CROHN DEL INTESTINO DELGADO
J331;DEGENERACIÓN POLIPOIDE DE SENO PARANASAL
S066;HEMORRAGIA SUBARACNOIDEA TRAUMÁTICA
K421;HERNIA UMBILICAL CON GANGRENA
W542;MORDEDURA O ATAQUE DE PERRO, EN ESCUELAS, OTRAS INSTITUCIONES Y ÁREAS ADMINISTRATIVAS PÚBLICAS
D691;DEFECTOS CUALITATIVOS DE LAS PLAQUETAS
G609;NEUROPATÍA HEREDITARIA E IDIOPÁTICA, SIN OTRA ESPECIFICACIÓN
D060;CARCINOMA IN SITU DEL ENDOCÉRVIX
J81;EDEMA PULMONAR
Z039;OBSERVACIÓN POR SOSPECHA DE ENFERMEDAD O AFECCIÓN NO ESPECIFICADA
F29X;PSICOSIS DE ORIGEN NO ORGÁNICO, NO ESPECIFICADA
T852;COMPLICACIÓN MECÁNICA DE LENTES INTRAOCULARES
M872;OSTEONECROSIS DEBIDA A TRAUMATISMO PREVIO
K260;ULCERA DUODENAL, AGUDA CON HEMORRAGIA
S467;TRAUMATISMO DE MÚLTIPLES TENDONES Y MÚSCULOS A NIVEL DEL HOMBRO Y DEL BRAZO
K512;PROCTITIS (CRÓNICA) ULCERATIVA
M215;MANO O PIE EN GARRA O EN TALIPES, PIE EQUINOVARO O ZAMBO ADQUIRIDOS
H601;CELULITIS DEL OÍDO EXTERNO
R065;RESPIRACIÓN CON LA BOCA
Z717;CONSULTA PARA ASESORÍA SOBRE EL VIRUS DE LA INMUNODEFICIENCIA HUMANA [VIH]
T797;ENFISEMA SUBCUTÁNEO TRAUMÁTICO
M359;COMPROMISO SISTÉMICO DEL TEJIDO CONJUNTIVO, NO ESPECIFICADO
Q518;OTRAS MALFORMACIONES CONGÉNITAS DEL ÚTERO Y DEL CUELLO UTERINO
F066;TRASTORNO DE LABILIDAD EMOCIONAL [ASTÉNICO], ORGÁNICO
C318;LESIÓN DE SITIOS CONTIGUOS DE LOS SENOS PARANASALES
M060;ARTRITIS REUMATOIDE SERONEGATIVA
T783;EDEMA ANGIONEURÓTICO
S880;AMPUTACIÓN TRAUMÁTICA A NIVEL DE LA RODILLA
M841;FALTA DE CONSOLIDACIÓN DE FRACTURA [SEUDOARTROSIS]
K351;APENDICITIS AGUDA CON ABSCESO PERITONEAL
Q519;MALFORMACIÓN CONGÉNITA DEL ÚTERO Y DEL CUELLO UTERINO, NO ESPECIFICADA
Z743;PROBLEMAS RELACIONADOS CON LA NECESIDAD DE SUPERVISIÓN CONTINUA
A418;OTRAS SEPTICEMIAS ESPECIFICADAS
E012;BOCIO (ENDÉMICO) RELACIONADO CON DEFICIENCIA DE YODO, NO ESPECIFICADO
D269;TUMOR BENIGNO DEL ÚTERO, PARTE NO ESPECIFICADA
M192;ARTROSIS SECUNDARIA DE OTRAS ARTICULACIONES
A085;OTRAS INFECCIONES INTESTINALES ESPECIFICADAS
H271;LUXACIÓN DEL CRISTALINO
R54X;SENILIDAD
L668;OTRAS ALOPECIAS CICATRICIALES
R300;DISURIA
O233;INFECCIÓN DE OTRAS PARTES DE LAS VÍAS URINARIAS EN EL EMBARAZO
G919;HIDROCÉFALO, NO ESPECIFICADO
J440;ENFERMEDAD PULMONAR OBSTRUCTIVA CRÓNICA CON INFECCIÓN AGUDA DE LAS VÍAS RESPIRATORIAS INFERIORES
